,title,score,id,subreddit,url,num_comments,body,created
3,My mother was a baker,126,gybodg,nosleep,https://www.reddit.com/r/nosleep/comments/gybodg/my_mother_was_a_baker/,9,"My mother was a baker. When I was small she’d sit me on the countertop and feed me the most delicious pastries and cakes and pies I’d ever tasted, eyes twinkling with delight at every positive note I gave. She would work at a recipe until it was perfect, pouring her entire heart and soul into every dish and waiting on tenterhooks for the satisfied moans she knew came from us with every bite.

Father was a foodie. I think that’s why he fell in love with her in the first place. Mother adored cooking and father could eat and eat and eat and eat until his shirt buttons pulled and his stomach threatened to burst. Never much of a cook himself, father very proudly worked for Marshel Foods, a canning factory in town. He’d often say that it was the closest he’d ever come to making a delicious meal.

I remember the day the factory closed. Mother and I were in the kitchen, the smell of warm cinnamon sugar tickling at my nose, when father swayed through the door. I’d never seen him drunk before. He stumbled his way to the living room and collapsed unceremoniously into his arm chair, bottle of golden syrupy liquid sloshing in hand. 
That evening I was sent to bed early with a plate of fresh cookies and a glass of warm milk. I drained the glass quickly and pressed it against my bedroom wall, listening closely to the hushed apologies from father and his desperate promises to find a new job, whatever it took, and that all would be okay. 

I remember when mother taught me to make pie crust. Her expert hands made light work of rolling dense pastry, forming each little rose decal with floured fingers so delicately I was mesmerised. We ate in silence that night, father yawned into his food, sipping languidly on a finger of that same golden liquid. He’d spent the morning making calls and scouring the papers for work to no avail. Mother smiled at me from across the table, though it did not touch her eyes. 

I remember trying to sleep through the hissing voices in the living room. Father angry at his 10-some years wasted with a company who could so easily disregard him. Mother trying her hardest to keep him calm, to encourage him as she always had. I could hear fathers slurred words becoming more incoherent as the evening went on. The sound of the neck of a glass bottle tapping heavily against the lip of a tumbler seemed to echo through the house endlessly that night. I didn’t know one human could consume so much liquid.

I remember the colour of mother’s first bruise. Blue like the sky, purpling in places and almost green in others. She wore her hair down that day, letting the soft strawberry-blonde tendrils brush gently over her swelling eye. Then she taught me to make white cake, her own mother’s favourite. She let me lick the icing from the spoon. 

I remember the day father stopped making phone calls. His beard had grown long and his stomach hung freely out of his shirt, too large and swollen now to be concealed. I watched a bead of sweat roll from his forehead and land on the dinner table. I shuddered at the thought. 

I remember hearing mother scream for the first time. A sound so unnatural I wasn’t sure it was real. The sharp, shrill sound stung my ears, reverberating around my body and forcing bile up into my throat. I knew what he was doing, what he was taking from her. 

I remember the first time I tried to ask him to stop. I woke early and peered in mother’s doorway. Even in sleep she was beautiful. I tiptoed downstairs to find father half awake in his arm chair, hungover and stinking of rot. He looked at me through bloodshot eyes, squinting as the early morning sun forced its way through the curtains like an unwelcome guest. I opened my mouth to speak, but the words never came. Instead, a sharp, burning sensation made itself known across the left side of my face. My head snapped at the force of his open palm. I spent the rest of the day in my room. Mother baked brownies and left them outside my door, but father got to them first.

I remember my 12th birthday. Mother made chocolate cake adorned with spirals of fresh sugar soaked strawberries, my favourite. Father ate his slice in his arm chair, the crumbs tumbling down his wiry beard and collecting on the bulging ridge of his stomach. Mother winked at me from the kitchen as I stood in the doorway coveting my piece. I’d come to learn that if I didn’t eat quick then father would gobble up everything in sight, leaving nothing but the crumbs on his shirt. 

I remember the day father stole from me. I lay stiff and cold in my bed. Mother’s screams had turned to silence early that night and my stomach twisted anxiously. It knew before I did. 
Fathers footsteps were heavy and lazy, pausing often on the stairs while the owner took breath. He stumbled and wheezed his way across the hall, through my door and into my bed. When he left, I dreamt of him. Grunting like a stuck pig and sweating all over me. I woke up stinking of his rot. 

I remember the look on mother’s face when she realised what he’d done. Her soft features were hard and dark, like seeing an angel shrouded in blackness. 
She held my hand under the dining table while father gorged himself, snorting and gasping with every bite of dinner. He didn’t seem to notice our empty plates- or maybe he didn’t care. We left him to sleep in his arm chair that night. Mother crawled her delicate frame into bed with me and held me while I wept and finally fell to sleep, the sound of fathers guttural snoring fading quietly into nothingness.

I remember waking up alone the next morning, an unbelievably delicious smell pulling me from my slumber. I made my way to the kitchen and took my usual place on the countertop next to mother. She was humming a beautiful tune, smile tugging gently at the corners of her lips as she washed the red from her hands. I helped her roll thick pastry, helped her make delicate rose decals. The filling was already prepared. 
 
I remember watching steam swirling gracefully from fresh pies cooling on the kitchen windowsill, my mouth watering impatiently. I stifled a laugh. 

I guess father made a delicious meal after all.",1591562579.0
4,"When I was younger, I was told I was never allowed to leave my room after 9pm, one night I discovered why. (Part 4)",62,gye1xk,nosleep,https://www.reddit.com/r/nosleep/comments/gye1xk/when_i_was_younger_i_was_told_i_was_never_allowed/,5,"[Part 1](https://www.reddit.com/r/nosleep/comments/gu9jmy/when_i_was_younger_i_was_told_i_was_never_allowed/)
[Part 2](https://www.reddit.com/r/nosleep/comments/gw4enl/when_i_was_younger_i_was_told_i_was_never_allowed/)
[Part 3](https://www.reddit.com/r/nosleep/comments/gxctma/when_i_was_younger_i_was_told_i_was_never_allowed/)

I was frozen to the spot. The body twitched for several minutes before it slowly got up. It got up! 

There was blood all around it. I whimpered as it turned its blood soaked face toward my fear stricken one. I sat still for a moment before it began to slowly shuffle toward me. It’s arms reaching out. 

As it edged closer to me, I screamed, I screamed till my throat was red raw. The body, the animated corpse. It was my mother. 

The red room was small, quite rectangular so I didn’t really have many places to run to. The good thing was, the corpse that was my mother was slow so I was able to get away from her by walking to the other side of the room. I knew that I couldn’t do that forever and it wasn’t sustainable but for now, it would do. I just couldn’t bear to look at my poor mother’s face. 

‘’Mum, please.’’ I pleaded with her. 

‘’Mum. What happened to you. Where’s dad?’’ 

I knew that she would be incapable of answering my questions, due to the fact that she no longer possessed a tongue. Could she understand me? I didn’t know. 

This clearly wasn’t my mother anymore. She was staggering towards me, her stance likened to that of a zombie. Hell, she was a zombie. Blood oozed out of her mouth, her teeth black. Her eyes were entirely devoid of any life, any emotion. She was empty, a husk. All that was left of her was the awful essence of the Baba Yaga. These were the consequences I was telling you about. 

Let me tell you a bit about my mother. She was always kinder to me than my father was. Sometimes when my father would order me to my room even though I was hungry and they failed to feed me, I’d catch these little sympathetic glances from her toward me. Little sideward looks of pity. Still, she did very little to help me. 

My mother was always the one to leave me food outside my room though, always the one leaving me bottles of water to drink, especially in the summer when temperatures were stifling and I was still confined. I always had a feeling that my father attempted to forbid these somewhat kinder gestures but she continued. I really appreciated her for that. 

But other times, she could be just as cruel as my father was. She could be unkind and that would confuse me. She was the one that bestowed the gift of the Russian book that first introduced me to Baba Yaga. 

My parents barely ever spoke to me, aside from the usual ‘Go to your room, Anna’ or ‘Stop crying, Anna’ So when I received the book, I took it as a kind gesture, from my mother. I had no idea that it would turn into my being pursued and haunted by something that was supposed to be a simple, kind deed. The receiving of a good book. How was I supposed to know that this would happen to me. All I ever yearned for, was love and I never got it. Was she cruel to me? Yes. Did she love me? I doubt it. Nevertheless she was still my mother and I loved her. I never wanted to see her like this. 

The dead thing that was my mother continued to pursue me in slow, deliberate motions but I managed to dodge her advances every single time. I knew I had to get out of the red room, but how? I didn’t even know where I was. I was sure I was no longer in our house since we didn’t have any rooms that resembled this nightmare. 

My thinking was shrewd, fast. I picked up several candles and threw them at the corpse and watched as it writhed in agony but still, it was relentless. It just kept coming and coming. Trying to grab me at every turn. Strangely, as I threw the candles at my mothers corpse, I noticed that nothing else in the room was setting alight. The candles would hit the corpse and then just extinguish after hitting the floor. It wasn’t normal but then nothing was normal here. I decided to try something else. 

I ran towards the scattered books. I picked up my fairy tale book and I quickly moved toward the spell book before my dead mother got too close to it. I picked it up, thinking the reanimated corpse of my mother was the doing of this spell book so I wanted to burn it. I tried to set it on fire but it just wouldn’t burn. I picked up several candles and tried to set it ablaze but nothing happened. The book stayed perfectly intact. 

Then suddenly, I heard a piercing shriek. It shook the room like an earthquake. The dead body of my mother fell to the floor, lifeless once more. The red room crumbled around me and as I shut my ears to stifle the sound, I noticed they were bleeding. I fell to the ground, the books scattering around me. Before I lost consciousness, I vaguely remember Baba Yaga flying across the collapsing room towards me on her mortar, aided by the pestle that also doubled up as her ‘wand’. Her spindly knees touching her crooked chin as she flew. 

I saw her blood soaked mouth and her wide, demonic eyes coming toward me as my own eyes fluttered shut. 




I awoke startled, disorientated and completely engulfed by fear. I touched my face, my eyes, my mouth, everything was still there, still attached. I felt for my pulse, it was beating, albeit erratically. My heart was still intact. 

I looked around me and cried out. I was in a forest, a deep birch forest surrounded by thick trees. The body of my mother was there too, it lay, surrounded by candles not too far away from me. The body was limp, unmoving, dead but I was cautious about taking my eyes off of it, just in case. My attention was stolen away by a slow but monotonous chanting, the same chanting that I heard when I was back at the house. Amongst the chanting, I could also hear a plethora of different sounds, whispers and cries. It was the cries and whispers of children, men and women. I could hear the anguish in the voices of those lamenting. I stood up and that was when I saw the hut. The hut that was supported by giant blood covered chicken legs. 

I stared at it, horrified. The sight was picturesque, it looked just like the painting at the house and frighteningly resembled the illustrations from my book. I took a step backward when I saw it’s legs begin to...move.",1591571233.0
5,Baby monitor,523,gy3mh2,nosleep,https://www.reddit.com/r/nosleep/comments/gy3mh2/baby_monitor/,41,"Baby Monitor

I was about 6 months old and a relatively loud whiney baby. Not proud to admit it but what can you do about it when you're that young. After being born my family moved into my grandads house as it was financially better for us to have a roof over our head and all to live together for the short term. 

Altogether was myself, my mother, father gran and grandad.  I'm now 27 just to try and put a time and date of when this happened. The house is a big, 1800 Victorian house with 4 levels. It has a creepy history and the story goes that my grandad bought the house from a doctor/surgeon. Who would often bring his work back home and have procedures inside the house. As we all know...not all are successful and one of the rooms (now I've moved out) I've discovered which one was the morgue...

 For once it was only just me and my mum in the house as everyone was out for work or so I thought. She was going about her daily chores whilst having to look after a 6 month old baby. I had just been taken out of the bath and carried to my crib, being placed on the bed to be dried with a towel gently wrapped about me. My mum could smell the cooking start to burn as she had forgot she had put on a small pizza earlier on that day. In a panic she made her way to the kitchen which was on the other side of the house but on the same floor whilst grabbing a baby monitor on her travels. Finally pulling the toasted remains of the pizza out of the oven she could hear my cries through the monitor as she would expect...(who would like to be slightly wet laying on a bed who can blame me?) all of a sudden the atmosphere in the house suddenly changed and what my mum heard next still sends shivers down our spines of the family to this day. 

As my mum recalls she heard a soft but faint voice of an older woman trying to shh me to sleep. In a way of what you would expect from an older relative say grandparent. My mum at first though it was some interference but when she started to hear my cries turn into silence she panicked and like any other mother would do, she dropped the burnt pizza and ran as fast as she could to the room I was laying. I am now tucked up in my cot, blanket pulled at neck level as if somebody had physically moved me into a sleeping position. My mum rang the police in a panic and they had arrived within 20 minutes, searching the house from top to bottom and no sign of any break in. The police officers could tell by mums expression that this was no joke but after trying to calm the situation they left and it was just me, my mum and whatever the presence was still remaining inside the house. This is just one of a few stories involving the 'old woman in the victorian house'...",1591523200.0
