,title,score,id,subreddit,url,num_comments,body,created
8,"I'm on display at Mr. McCallister's Odditorium. Someone please, help me escape. (Part 1)",14,gyjkl4,nosleep,https://www.reddit.com/r/nosleep/comments/gyjkl4/im_on_display_at_mr_mccallisters_odditorium/,1,"My name is Alice. I need to write that down before I forget it. I don’t know how much time I have before he comes back, so I’m going to try to write this down as fast as humanly possible. We’re all so terrified. There’s about 10 of us, and he hasn’t finished his collection. I need to stop him before- I don’t know. Sorry, let me calm down and start over.

I’ve always been a loner. No siblings, not many friends. I guess I’ve always been more focused on my work. I’ve dated guys, but none of them stick around. They always said I’m too “detached”. I didn’t mind then. I lived in Manhattan, and I always had work to keep me busy. That is, until my parents died unexpectedly. Car crash. I was upset, sure, but I wasn’t very close to my parents if I’m gonna be honest. So imagine my surprise when I got a call from my family’s attorney saying that they left me the house. My childhood home. In the middle of east bumb-fuck nowhere. I begrudgingly packed up my shit and moved down there, hoping I could sell it quickly and get back to my life.

My hometown is very small, an “everybody knows everybody” type of place. So it was very unsurprising that all of my neighbors took extreme interest in me moving back home. The first couple days I was home I was bombarded by neighbor after neighbor pounding on my door, wanting to see “how I was doing” or “what I was up to”, which very quickly became borderline unbearable. It wasn’t until the third day I was there that my childhood friend, Ray, knocked on my door.

“Alice- hey!”

“Oh my god Ray, is that really you?” I’m not a hugger, but when he went in for one, I didn’t pull away.

“Yeah! I heard you were in town, so I figured I would stop by! I’m really sorry about your parents…”

I didn’t really know what to say, so I muttered a thank you. We stood there for a moment, an awkward silence permeating the air. Eventually, Ray spoke again.

“Hey… do you remember that carnival we went to as kids?”

“Oh my god, yes!” I laughed, “Those were always so fun! God, I’m sure there’s about a million cheap stuffed animals from the ring toss stuffed in a box somewhere…”

Ray laughed heartily, “Oh my god, yes! You killed that game!”

“Yeah, I always beat you!” I laughed, and he put on an offended face, clutching his pearls.

“Well excuse me! I was going to ask you to go with me tonight, but apparently I’m not good enough for the ring toss queen, so I’ll just be going…” He joked, dramatically turning around, pretending to leave.

“Wait! The carnival is in town?”

He spun around, a stupid grin on his face. “You bet it is! What do you say?”

I laughed. This was the most interesting thing to happen to me since I got back. “Yeah, that would actually be great! Meet you at 8?”

“Deal!” He smiled, before jogging back to his car and driving away.

We spent the entire evening talking and laughing. I beat him at ring toss (again), and after stuffing our faces with funnel cake, we took a lap around the fair. We stopped in front of a structure I had never seen before.

It was a worn tent in a red and black striped pattern. One flap of the tent was pinned open, the darkness inside almost permeating the air. I shuddered. I don’t know what it was, but something about this tent seriously creeped me out. A large sign was staked into the ground, written in a very floral font, matching the tent in coloring.

*Mr. McCallister’s Odditorium*

“Oh I heard about this place!” Ray exclaimed, breaking me out of my fog. “It’s a freak show, you know, bearded ladies, conjoined twins, that kind of stuff. Let’s go in!” He said, grabbing my arm and dragging me to the tent. I stayed still, pulling my arm out of his grasp.

“Um, I don’t know Ray, I don’t really feel okay with gawking at people’s deformities…”

“Come on, Alice, it’ll be fun!” He said with a tight lipped smile, annoyance in his eyes. Something was off with him. I shook my head, and he grabbed my arm so tight I could see the blood beneath his grip drain from my wrist.

“Alice, let’s just go!” He forced me toward the tent, but I stood my ground, pulling against him, before eventually yanking my arm from his hold.

“Ray, seriously, what the fuck is wrong with you? I don’t want to go in!”

He rubbed his hand over his face, frustrated, before sighing at looking at me.

“Sorry. I just really wanted to go in, it was actually the reason I wanted to come to the fair. But nevermind, I’ll come back another time.” He smiled, but it didn’t quite reach his eyes.

“It’s fine Ray, let’s just walk around some more, okay?”

We walked around for a little while longer, before it seemed like the carnival was starting to shut down for the night. We hopped into Ray’s car and he drove me home. As I was getting out after saying goodnight, Ray stopped me, putting his hand on my arm gently.

“Hey, Alice. I.. I just want to say I’m really sorry.”

“Ray don’t worry about earlier, it’s totally fine.”

There was a strange look in his eyes. He looked almost guilty. His eyes were glistening, tears threatening to fall.

“Alice, I’m so, so sorry.”

Weirded out by his behavior, I just nodded at Ray, getting out of his car and jogging to my parent’s house.

It was almost one in the morning, so I quickly got ready for bed, suddenly really exhausted. I quickly checked that the door was locked, still weirded out about Ray, and I passed out as soon as my head hit the pillow.

At around three in the morning, I woke up to a creaking sound coming from the living room. Trying to tell myself that it was just the house settling, I attempted to go back to sleep, but the creaking seemed to get closer. Getting slightly nervous, I quietly crept out of bed, looking for any sort of weapon, eventually grabbing a decorative clock off the bedside table. *This’ll have to do, I guess*, I thought to myself, internally rolling my eyes at my behavior. *This is a super safe neighborhood, it’s probably nothing,* I kept repeating to myself, as I slowly opened the door, peeking out into the darkness. I didn’t see anything, so I quietly crept into the living room, double checking that the door was locked. I breathed a sigh of relief when it was, and just as I was about to turn around and head back to bed, someone grabbed me, wrapping me in a bear hug. He was strong. Inhumanly strong, and I could see his massive arms and bulging veins, even in the darkness. I tried to scream, but he fought me, dragging me further into the house. He held me with one arm, and I felt him reach into his back pocket, before brandishing a white cloth. He shoved it into my face, holding it over my nose and mouth. I fought, I fought so hard, kicking and screaming, but my vision quickly started to get blurry, and soon, I passed out.

I woke up in a dimly lit room, the fluorescent lighting hurting my eyes. It was bare, save for the metal table I was strapped to. I tried to move, but the restraints were tight. It was when the initial haze wore off that I realized that my entire body was on fire, like I was stung by a million hornets. I wanted so desperately to look and see what was wrong, but my head was in some sort of trap. The pain was agonizing, and I let out a whimper, trying to make as little noise as possible. A few moments later, I heard a metal door open and shut behind my head. A deep voice chuckled, immediately chilling me to the bone. Eventually, a man loomed over my head, a surgical mask covering his face.

“Well, well, well. My little treasure is awake.”

I tried to speak, but I realized my mouth was also in agonizing pain, so I kept it shut.

“You’ll make a fine addition to my collection, Tabitha.”

My eyes widened. I spoke weakly, despite the pain.

“Tabitha? You… you have the wrong person. My name is Alice.”

He laughed, his eyes dancing. “Not anymore it’s not.”

He began undoing my restraints, before eventually releasing my head from the trap I was held in.

“Wha- what are you doing?”

“Well, I figured I would let you be the first to see your new look.”

“My- what?”

He ushered me over to an object covered by a tarp in the corner of the room, before ripping it off with a flourish. I fought back a scream at what I saw.

Tattoos covered my body from head to toe. All over my face, my stomach and arms, my feet. Every inch of skin was covered. I was clad in a small leather bikini and a choker. My hair was dyed black and styled in finger waves, and my makeup was meticulously done to resemble that of the 1920’s. My eyes were electric green, and my pupils were slits, like a cat’s. I slowly opened my mouth, to reveal razor sharp fangs, and a forked tongue.

“Presenting… Tabitha the tattooed lady!” He cackled, insanity in his eyes. I fled to the corner of the room to throw up, and he only laughed harder at my reaction.

“Don’t worry Tabitha, you’ll get used to it eventually.” And with that, a large man burst into the room. Before I knew what was happening, a white cloth was pressed against my nose and mouth, the world fading to black once more.

I woke up in a cage. I recognized the coloring of the small tent immediately. I looked around, taking in the many cages that lined the tent. Every cage was filled with a person, faces twisted with misery. I looked to the tops of the cages, seeing that atop each one, a sign in that similar floral font from the front sign, displayed their names:

*The Siamese Twins*

*The Lobster Girl*

*The Human Skeleton*

*The Reptilian Man*

Those were the only ones I could make out in the dim lighting, the others were too far away to see. A few moments later, people started flooding the tent, ooh-ing and ahh-ing at us. I rushed up to the front of the cage, holding tight to the bars. I called out to the closest people.

“Please, please help me! They kidnapped me, and they’re holding me hostage!”

The couple looked at me, taking in my eyes and body, before beginning to laugh.

The man turned to the woman, “Wow, they train these freaks well, it really ups the creep factor!”

The woman laughed, and they continued their walk, taking in the morbid curiosities surrounding them.

I tried to catch the attention of several other patrons, but they all laughed me off. Tears began to spill down my face, when I heard a mumble to my left.

“Don’t bother, they won’t believe you.”

It was a man in a suit, hair parted down the middle and slicked down. He was traditionally handsome, blue eyes and a strong jaw. It wasn’t until I looked down that I saw his third leg. My jaw dropped.

“It isn’t mine.”

“What?” My eyes snapped up.

“The leg,” he whispered, “It isn’t mine.”

I just stared at him, unable to fully process what was going on.

“Look,” he said, “I’ll explain everything as soon as we’re on the road. He won’t be able to listen in on us then. But until then, I’m James, the three legged man.”

“I’m.. Tabitha, I guess.” I said, eyes lowering, anger warming my belly.

“You can tell me your real name later, okay?” He offered a small smile.

I nodded, before returning to the small stool that sat in my otherwise empty cage. I sat there for what felt like hours, watching the patrons laugh and whisper at my appearance. Tears spilled down my face, but it only seemed to make the patrons laugh more. I could see the sun was starting to set through the small opening created by the tent flap. As I was about to turn away, he walked in.

Ray.

He perused the cages, taking his time. Shock quickly turned into fury as I ran to the front of my cage, growling in pure anger. I shook the bars, screaming until he finally looked over and saw me. The color drained from his face, and he ran over to my cage, making sure he was out of my reach.

“Alice-”

“I’LL KILL YOU RAY, I SWEAR TO GOD-”

“I didn’t mean for this to happen, Alice I’m so sorry-”

“How could you do this to me?!” I yelled, swiping at him.

“He threatened to take my sister unless I could find a replacement- I- I had to save her, I’m so sorry…” Tears were spilling down his face.

“Fuck you. FUCK YOU. As soon as I get out of this hellhole I’ll fucking kill you!”

It was then I heard that familiar cackle that I froze.

“Well hello again, Ray! You’ve brought me a lovely specimen,” He said, patting him on the back, “I can’t thank you enough!” He said, tipping his bowler, before straightening his suit jacket and walking toward the bars of my cage. I attempted to swipe at him, but he caught my wrist, squeezing it until I yelped in pain.

“Now Tabitha, you’re going to be a very good girl, otherwise I’m going to have to sedate you.”

I growled at him, pushing against the bars.

“Fuck you.”

He squeezed my wrist tighter, crushing it. “Now that’s not very nice language to use in front of my guests. Very well- I’ll get Bruce to administer-”

My eyes widened. “No! No, I’ll be good. I promise.”

He smiled, revealing crooked, yellowing teeth, before releasing my wrist. “Very good. Now sit in your chair like a good girl. And, push up your breasts, would you? I want everyone to see my excellent handiwork.” And with that, he turned on his heel, his coattails catching air, before strutting away. I started crying once more, shoulders shaking with my silent tears, before doing as I was asked, and returning to my stool.

“Alice..”

I looked at Ray, pure despair reflected in my eyes.

“Please, go.”

He looked at me one more time, before leaving the tent. He never came back.

For the next two days I did as I was told. I sat, and stayed silent as people took in my appearance. But all the while rage burned in my gut. I needed to get out of here, I just didn’t know how. Towards the end of the night, a drunk man stumbled into the tent. He shook the bars, sneering at all of us, spitting out insults and reaching inside the bars, attempting to grab us. After reaching for me, he spun around, leaning against the bars of my cage. It was then when I saw it. His iPhone was hanging out of the back pocket of his jeans. I saw it, relief flooding my eyes. My golden opportunity. I crept up behind him, slowly plucking his phone out of his pants pocket, before stuffing it in the back of my bikini bottoms. He whirled around at me, taking in my appearance.

“What the fuck do you think you’re doing?”

I froze. “I- uh…” An idea struck me, and I swallowed my pride. “I just… wanted to say hello to you, handsome.” I winked at him, trying to keep down the bile rising in my throat.

He smirked, using the bars of my cage as an attempt to steady himself.

“Well… you’re pretty hot, for a freak. Why don’t you let me in that cage of yours?”

It was then that Mr. McCallister showed up, quickly apologizing for my behavior and ushering him out the door. He stalked over to me, lowering his voice.

“I don’t know what you think you’re doing, but you better go back to your chair and sit like a good girl.”

I tried to hide my smirk as I nodded, returning to my stool.

The idiot didn’t have a passcode on his phone, thank god. I can’t call anyone, but there’s no service anyway. He had this app on his phone and I figured this might be a good place to write this down. He’ll be coming back any minute, but please, if you can, help us. We’re about to go on the road to the next town, so hopefully I’ll be able to get some answers from James. I have no clue where we’re going, and there’s no one in my life to come looking for me. I’m scared. God, I’m so scared. Earlier today, I saw them moving several empty cages, blank name plates placed on top.

He wants more of us. And there’s nothing I can do to stop him.",1591589810.0
