,title,score,id,subreddit,url,num_comments,body,created
0,May 2020 contest nominations,57,guizl6,nosleep,https://redd.it/guiyr4,0,,1591039928.0
1,All of the women in my family die at age 27. I turn 28 in 2 hours and 32 minutes.,6091,gyb0dz,nosleep,https://www.reddit.com/r/nosleep/comments/gyb0dz/all_of_the_women_in_my_family_die_at_age_27_i/,200,"My dad always wanted a son. He got three daughters instead.

He hated us all, hated my twin sisters, hated my mother… but hated me most of all because I was the last child my mother had before she died. That didn’t stop him from treating me like his little boy, didn’t stop him from attempting to beat the hatred of my own gender into me. *Quit your crying*, he’d snap, *or you’ll end up like your sniveling bitch of a mother*. After years of that shit, he was shocked that I grew up as a tomboy.

I think he hated that even more because I was just a constant reminder of what he never got to have.

My mother died when she was only twenty-seven, when I was only four – the coroner ruled her death a natural passing, some weird heart complication that took her in her sleep. My dad, though, he says it was because of her family’s curse. Whenever I came to him, desperate for more information about a mother I never really knew, he never had much to say. I’m convinced he was just drunk since the day she died. *Every woman in her damn family, they die when they’re twenty-seven*, he’d sputter in between belches, his breath reeking of stale beer.

I think the real curse is that my mom was the one to die, and not him.

I wasn’t fully convinced by the ramblings of a perpetually drunk man, but when I lost both of my sisters just months before their twenty-eighth birthday, I knew it couldn’t be a coincidence. Moira was found murdered, her face practically blasted off by a shooter while she was on a jog. Joy took her own life only days later. I was the one who found her, hanging in the bedroom of her apartment as I came to pick her up for Moira’s funeral. She’d been there, swinging from the rafters, all night.

It’s hard to live a normal life when you know you have an expiration date, especially when it encompasses an entire year. I always dreaded my birthday, which from an early age became associated less with fun and birthday cake and more with worry and funeral caskets. But once Moira and Joy died, my next birthday – twenty-five – was the most dreadful day of my life. Twenty-six was worse, twenty-seven unimaginable.

*This is it*, I thought as I closed all of the blinds in my apartment, downing the last drop of vodka in the bottle. *This is the last year of my life.*

Twenty-seven has been uneventful, to say the least. Why would I make any long-term plans, forge any meaningful relationships when I know they simply cannot last? The worst part of this last year has been simply *not* knowing when my impending death is coming – it could have been any day within the last three hundred and sixty-four. It could be within the next minute.

I must admit I became something of a recluse, my windows always shuttered, additional locks installed in my door, letting the phone ring through to voicemail, hiding under my covers with the lights out whenever I got a knock on my door. I stocked up on preserved foods and various goods that I would need to last the year. I was so paranoid that I even covered my mail slot, stuffed a towel in the space beneath my front door. I didn’t want anything getting through from the outside world – god forbid, an *anthrax letter*.

Falling off the face of the earth didn’t matter much, anyway – I didn’t have friends or family anymore. My mother and both of my sisters were dead, and my dad disowned me when I came out as a lesbian after my sisters died. I moved away and severed contact soon after.

The night before my twenty-seventh birthday, I started getting these strange phone calls from a blocked number. I’ve always had anxiety about phone calls, so I just let it ring. The number kept calling, at least once per day throughout the past year. Then the knocking started, once a week at first, but it’s only been getting worse – more frequent, and the pounding on my door more frantic each time. Convinced it had something to do with my inevitable death, I’ve been driven mad by the unknown visitor, especially over the past week.

I got ready for bed last night, knowing that tomorrow – today, now – is the day I will turn 28. My time had run out, and I searched for comfort in a bottle of liquor. I didn’t find it. I fell into bed, drunk and delirious, and prayed the morning wouldn’t come, though I knew it would. I eventually got to sleep, but it was restless and unsatisfying. The kind of sleep where you feel like you have one eye open, always watching.

That’s why I was quick to wake when the door to my bedroom creaked open early in the morning, before the first sign of light. I shot up in my bed, glancing around my room in a frenzied panic, at first seeing nothing out of the ordinary other than the door, pushed slightly ajar. A closer look revealed something I’d missed, something that sent my heart racing, froze me to my core. Two dark figures stood in the empty space behind the half-opened door, unmoving, almost like a pair of statues.

Waiting. Watching. Wordless.

“Leave me… leave me alone,” I squeaked, unable to move, paralyzed in the power of their presence.

The shadowy figures instead shuffled out from behind the door, creeping slowly towards me in the dark. I knew this would certainly be the end of my life, the fulfillment of my curse, if I didn’t act. Suddenly recalling the self-defense methods I’d drilled into my mind, I flipped my bedside lamp on to stun the intruders and reached underneath the table to pull the knife I’d duct taped there a year ago – a twenty-seventh birthday gift to myself.

As soon as the light flooded the room, though, I knew the blade would be of no use.

My intruders were not a pair of assassins – not human ones, at least. In the yellow light of the lamp I discerned the identities of the dark figures. They were my sisters. Joy stood at the foot of my bed, pale, in that same conservative black dress I’d found her dead in years ago, the one she’d picked out for Moira’s funeral. Her head hung at a right angle to her shoulders, neck grotesquely bent from her hanging.

Moira was a few steps behind her. I could only assume it was her, considering the severity of her injuries – she’d suffered a gunshot wound to the head, so brutal that we were not allowed to see her after her death, so intense that it had entirely disfigured her face. The lower half of her face had been reduced to a pit of gore, her jawbone barely attached on one side, her mouth mangled, with only several teeth remaining studded randomly throughout the mess.

“Why are you here?” I cried, gathering my knees to my chest and holding them tight. “Are you… are you here to take me?”

Joy made a feeble attempt to shake her head, the side of her face only brushing weakly against her shoulder. She waited several moments before putting one of her feet in front of the other, moving towards the side of my bed. As I recoiled instinctively, she slowed her pace. Moira trailed after her until they were both beside me.

I whimpered as Joy leaned over me, her head flopping forward suddenly with the motion, neck cracking sickeningly. With her lips brushing against my ear, she whispered, “she… she tried.” Her speech was labored and wheezing, as if her vocal cords had nearly been shredded.

“What do you mean, Joy?” I pleaded.

Her lips moved against my ear once more, but no sounds came out despite a clear strenuous effort. Moira wagered an attempt at answering my query, but only succeeded in sputtering blood from the gaping wound in her face, ejecting one of her remaining teeth onto the floor as her jawbone swung precariously, barely hanging on. She raised one hand, slowly curling it into a fist before striking her knuckles furiously against my bedpost.

The incessant sounds startling me, I forced my eyes shut tight and pulled my knees even closer against my chest. Moira’s knocking seemed only to escalate in volume, seemed to go on forever, until – finally – it stopped. I cracked my eyes open to find that both of my sisters had vanished, that the light of early morning had begun to spill in through the slats of my blinds. It was just past six o’clock, the seventh of June, the day of my twenty-eighth birthday.

I was born at 9:26 AM – once I learned of the curse, I burned the time of my ultimate expiration into my mind. I only had three hours and sixteen minutes left to live… if I even *had* that long. Draping my covers over my head, I resolved to spend the rest of my life asleep. I figured I’d rather pass peacefully in my sleep like my mother did than to suffer a fate similar to my sisters’.

My plans were interrupted, however, by that damned knocking on the door. The interruption usually didn’t come so early in the morning. I decided initially to ignore the strange visitor but pulled the blankets back down soon after as a certain sense of familiarity struck me. The pounding on the door reminded me all too much of Moira’s knocking just moments before.

It easily could have been a trick of the curse, but something compelled me to approach the door. “What do you want?” I called from behind the barrier, clinging to the relative safety it provided.

The reply came from an unfamiliar man’s voice. “I just have a letter for you, miss.”

“Just… just slide it under the door, and please leave,” I returned, using my bare foot to remove the towel I used to block the small space beneath it.

He deposited a bright yellow envelope under the door as I requested. I waited quietly for the sounds of receding footsteps before sliding on a pair of gloves to handle the letter. It was addressed to me, simply by first name and with no address. Carefully, I unsealed the envelope to reveal a birthday card. I hadn’t received one in years.

Bright, sparkling letters on the front formed the words, *Daughter, you’re 27!*. I scoffed at the sick joke. I hadn’t received a birthday card since I was a child, and my dad couldn’t even get my birthday right. I didn’t think he even knew my address. I cracked it open gingerly to read the message inside.

*Laura,*

*If you’re reading this, your father has killed me. Don’t believe a thing he or the police say – I was not the target of a random attack, I did not die of natural causes, and I certainly did not commit suicide. I would never leave you if I had the choice.*

*The truth is… I died is because I found the truth behind my family’s curse and foolishly told your father. He was in on it the whole time, planted in my life by some secret society to eradicate me. To eradicate us. What we have is not a curse, it is a gift – a gift of immense power. The power to heal, but the power to harm just the same.*

*We come into our power at the age of 28, a number associated with independence, leadership, and self-sufficiency. An age where we can handle the responsibility such a power inevitably comes with. It’s a strong number, and you will come into great strength, though you’ve always been a strong girl.*

*I hope you’ve made it this far, but at the same time… I know you have. You were always a feisty little girl for the four years I had the pleasure of knowing you, of loving you. You never let anyone tell you what to think or do – especially not your father.*

*Happy birthday – I love you.*

*Mom*

I closed the card softly, thinking on the strained words of my sister – mom had tried to warn them, but they didn’t listen. The pieces of the puzzle slid into place… my dad must have murdered Moira, and Joy ended her own life out of grief and a belief that she would inevitably be next.

At the time of writing this, I only have two hours and thirty-two minutes until I officially turn twenty-eight. Over the past hour or so, I’ve already begun to feel the power flowing into my body, electrifying as it runs through my veins. I will the towel to reposition itself under the door, and it does so, sliding across the floor on its own.

I need to keep myself safe until 9:26, after all. I’m planning on surprising my father with a visit [for my birthday](https://www.reddit.com/r/hercreation/).

[X](https://www.reddit.com/r/TheCrypticCompendium/)",1591559754.0
2,My girlfriend hasn’t moved in months,2217,gy5ee9,nosleep,https://www.reddit.com/r/nosleep/comments/gy5ee9/my_girlfriend_hasnt_moved_in_months/,101,"This all started about 4 months ago, we were looking at apartments together. Amy was so excited, this would be our first apartment together. I can still recall the happiness in her voice when she talked about organizing our bedroom. We finally settled on a newly built apartment building in a new development. 

The apartment was beautiful, but there wasn’t much nearby. Just a grocery store, railroad tracks and a pond. Amy expresses her joy of walking down to the pond and feeding the ducks. We signed our lease and began moving in. We spent the first few nights at our old apartments. My parents were bringing up their truck to move my bed in, but they were out of town for a few days. We finally were able to bring my bed over and Amy and I were officially moved in. I bought a bottle of champagne to celebrate. It was one of the happiest days of my life. All of that came to a crashing halt when I woke up the next morning. 

I was a little bleary eyed and hung over, but I noticed Amy wasn’t in bed with me. I looked up to see she was standing in the corner of our room, face turned toward the wall.” Amy, what are you doing,” I asked. No response. She didn’t move, she didn’t turn around, nothing.” Amy what’s wrong?” I got up and put my hand on her, she was stiff as a board. I tried to pull her away from the wall but she wouldn’t budge. I pulled with all my might but I couldn’t break her away from the corner. It’s like she was magnetized to the wall. I started to freak out and called 911. 

I told them I needed an ambulance and that my girlfriend is unresponsive. While I waited for the ambulance to arrive I reached out to her parents.” Hey, it’s me David, you guys need to get here now. I found Amy standing in a corner and she won’t respond.” “Who is this,” her father asked.”it’s me David, didn’t you hear me? Your daughter is in trouble and you need to get here fast.” “I don’t know a David, and I don’t have a daughter either. I think you have the wrong number pal.” He hung up on me. 

I frantically looked through my phone to see if I called the wrong number, I didn’t. I could see all the previous times I had called that number. I even found the text conversation with him about planning Amy’s birthday. Her father Phil likes to joke around but he took it too far this time. I called him back, straight to voicemail. I yelled into my phone.” Look Phil, I don’t know what your problem is, but this is no time for jokes. Something is severely wrong with Amy and you need to get her now!” 

As I hung up the phone there was a knock at my door, it was the police. I opened the door and I explained everything. I took them into my room to see if they could get her to move.” Son is this a joke,” the officer asked.” What do you mean, please just see if you can help her.”” Where is your girlfriend,” the office said.” There’s no one in that corner.” I couldn’t believe what I was hearing. I became explosive and started to yell.” I don’t know what’s going on here but you need to help my girlfriend, I need to know if she’s okay.” The officer told me to calm down or he would detain me, after a quick sobriety check to make sure I wasn’t on drugs, he decided to leave. I begged him to stay and help her. He told me to stop wasting the police’s time and then left. 

I ran back over to Amy to see if I could try and move her. She was still standing in the same exact position, hadn’t moved in an hour. I bent down to get a look at her face. She had a blank expression. I noticed that she was still breathing and blinking.”please Amy,” I begged,” tell me what’s happening.”I tried to move her again to no avail.  That’s when I looked up and realized that her plant that she kept on the windowsill was gone. When I looked around the room I noticed everything that she owned was gone. 

I ran into our closet, all of her clothes had just disappeared. I frantically ran all over the apartment, nothing. Everything she owned, that we spent days moving into this place, have just magically vanished. Even her car was gone. I decided to contact the property office to see if they caught anything that happened to her car on camera. When I explained they situation they told me that I rented that apartment by myself.” What, no I didn’t,” I cried.” You guys saw Amy and I sign the lease agreement. Can you please just look through the parking lot footage from last night.” The guy said he would but assured me that my signature was the only one on my lease agreement. I went to find my copy and sure enough, all her signatures and initials had disappeared from the paperwork. I felt like I was going to vomit. 

My head was spinning with a million questions. I spent the next few hours trying to get Amy to budge from that corner. I eventually gave up and cried myself to sleep. When I woke up the next morning my situation hadn’t change. She was still standing in that corner, hasn’t changed position since I first saw her. I tried to move her again but she was like a rock. I noticed she was still blinking and breathing so I tried to communicate.” Amy, if you can hear me blink twice.” Nothing, I decided to ask again.” Amy, if you know what is going on blink twice.” Again, nothing happened. She didn’t really seem to be blinking in a pattern or anything, just blinking sort of normally. I felt like I was losing my mind, I had no answers to why this was going on. I spent the day trying to contact other friends and family. Everyone had pretty much the same response. They all claimed they didn’t know her, and had no recollection of who I was. 

She was an honor student in high school and always made the honor roll. I tried searching the Internet for any school records, nothing. It was like Amy had vanished off the face of the earth, yet she was still back at our apartment. I spent the next few days searching the Internet trying to find any information on Amy. I never found any. Weeks started to go by. 

Everyday I would wake up and see Amy still standing in that corner. She never moved a muscle. Everyday I would try and move her, I never could. I became desperate for answers. I started going on religious/paranormal forums. I would ask anybody and everybody if they have ever seen or heard of anything like this. I went to forums on Christianity, Judaism, Islam, Hinduism, Pagan, paranormal investigator, even magicians. I asked everyone I could. Nobody had any answers. Nobody had ever experienced or heard about anything like what was happening to me. 

Eventually I just gave up. It’s been 4 months since this happened, I’ve gotten use to it. I try to spend as little time as possible in the bedroom. I really only go in there to sleep or get dressed. I feel so heartbroken, like I’ve lost Amy. Yet every night I see her just standing there. Still hasn’t moved one bit in 4 months. Still just blinking, still just breathing. I could just sleep out on the couch but I like listening to her breathing when I’m trying to sleep. Hearing her breathe is soothing to me. 

I see her everyday but I feeling like I’ve lost her. This apartment is so quiet without her. I miss her voice, her smile. I miss the arguments, and most of all her bubbly personality. It pains me so much to look at her now. Just to see her standing there, not moving. That blank expression every time I look at her face. I can’t take this anymore. I was planning on finding another place to live and move on. Then, yesterday morning the unthinkable happened..... she moved. 

I woke and found that Amy was no longer in the corner, she was standing at the foot of my bed. She had a big smile stretched across her face, her teeth were showing. She was no longer breathing or blinking. She was staring directly into my eyes. I just sat there in shock. I have no idea how long we were staring at each other, neither of us moved a muscle. Finally I cried out, “ Amy what’s going on, what happened to you.” She didn’t say anything to me. She started to slowly lift up her hand and stretched it towards me. It was as if time stood still. She never broke eye contact. I yelled out,” What are you doing Amy? I haven’t spoken to you in so long. Please just tell me what’s happening.” 

She finally spoke to me.” David, it’s time for you for you to come join me. Take my hand David, come with me.” I haven’t heard her voice in so long, I broke down. I jumped out of bed and grabbed her face.” Please Amy, I beg you, just tell me what’s happening. What has been going on with you.” She never spoke another word after that. She just stood there smiling with her hand stretched out. She never broke contact with me. I decided that I can’t stay here anymore. 

I packed and was ready to leave. I had made a reservation for a hotel and I was going to stay with my parents until I could find a new place. As much as it pains me I needed to move on. Whatever this thing is in my bedroom isn’t Amy. As I was packing my bags I looked over at Amy and she had a tear running down her face. She still hadn’t moved since this morning. Still smiling and still stick her hand out. Amy and I had been through so much together, she was the love of my life. It was like my heart was being ripped out from the thought of leaving her here. I decided to cancel my hotel reservation and spend one last night with her before going to my parents. 

As I laid in bed I had this incredibly uneasy feeling. She wasn’t breathing this time. Every time I looked up all I could see was her standing there. Still smiling, staring right at me. I didn’t sleep well that night. When I woke up I had received dozens of text and phone calls. 

All of them were from unknown numbers. Every text I read was apparently sent by Amy. They were all urging me to come join her, all I have to do is grab her hand. I starting to listen to the voicemails. It was Amy’s voice, she was crying.” David please, I need you to come with me. Please I need you to grab my hand.” Every single voice mail was the same. I looked back at Amy, she still had her hand out. I miss her so much. I would like nothing more than to see her again. I’ve already sent goodbye texts to my family and friends. A lot of them are trying to call me right now but I’m not answering. As I’m writing I noticed Amy’s eyes have started to bleed and her smile has become a lot more twisted. I hope I’m making the right decision here.",1591530734.0
